1-a.wav,"nós prevemos que sua janela de reabastecimento abrirá após"
1_op_prefix_ok-a.wav,"nossa janela de reabastecimento será aberta após"
2-a.wav,"nós achamos que sua janela de boxes para combustível deve abrir após"
2_op_prefix_ok-a.wav,"nós pensamos que nossa janela de reabastecimento abrirá após"
3-a.wav,"nossa janela de reabastecimento abrirá após"
4-a.wav,"nossa janela de abastecimento abre após"
5-a.wav,"nós achamos que sua janela de boxes para reabastecimento abrirá após"
5_op_prefix_ok-a.wav,"nossa janela de combustível será aberta após"
