1_op__prefix_oh_dear-a.wav,"limites da pista, vai logo, concentre se, eles vão deletar a próxima volta também"
2-a.wav,"limites da pista, eles apagarão esta volta e a próxima"
3-a.wav,"tu cortou a pista, eles vão anular a volta e também a próxima"
4_op_prefix_bad_luck-a.wav,"tu saiu dos limites da pista, eles irão deletar esta volta é a seguinte"
5-a.wav,"limites da pista, vai logo, eles vão deletar essa volta e também a próxima"
6-a.wav,"vamos, concentre se, mantenha se entre as linhas brancas, tu perdeu esta volta é a próxima"
7-a.wav,"limites da pista, eles irão deletar a próxima volta assim como esta"
8-a.wav,"mantenha entre as linhas brancas, eles apagarão a volta e também a próxima"
